병원에서 스트레스 물어보면 늘 고민해서 답해야돼 나는 병원에서 스트레스 물어본다면 스트레스 너무 많다고 할 거 같아 지금 나는 25년 인생중 최대 스트레스 상태라  그거 아님 그닥 스트레스 많이 받는 편이 아니긴 한데  그런가 아 근데 나는 진짜 상태 안좋았을때 죽는장면이 계속 떠오른적이 있서 그때를 기준점으로 비교하는듯 그래서 지금이 최고점이 아닐수도 있다생각해 헐 그때가 언젠데,병원에서 스트레스를 물어볼 때 고민해서 말하고 지금이 최고점이 아닐 수도 있다 생각한다
언니언니언니 바빠여  일둥이에열 왜영왜영 혹시 지금 보내줄수는 없져 뭐를 아아아아 헐 맞다 미안미안 어제 빠지가느라 아침부터 까먹었다 1분 내로 보내줄게 아뇨제가 도 죄송해요 으악으악 미안미안,언니에게 지금 바쁘지 않으면 보내줄 수 있냐고 하자 까먹어서 미안하다며 1분 내로 보내준다고 한다
핸드크림만 아아 10개 준줄 알앗셩 아냐아냥 핸드크림은한개 악 오해했넹,핸드크림은 1개인데 핸드크림만 10개를 준 것으로 오해를 했다
많이 차분해졋더니깤 오올  열심히네 궁금하다 차분해진 이름 아냐 내기준 그렇다는거지 차분하진않음타고난걸 바꾸진 못하는듯 걍 좀 낫다는거지  아니라 점점 조아질거라 나드 성격 많이 바꼈는데 머 웅 조아질거임 많이 조아졋는데 머  너는 어떠케바뀜,너의 기준에서 많이 차분해졌다니까 궁금하고 점점 좋아질 것이다
어제 저녁에 할거없어서 짜글이 끓여놓고잠 와우 나는 짜글이 먹을건데 너는 뭐먹게 이모티콘 나는 잘게   꿈에서 먹을게,어제저녁에 짜글이를 끓여놓고 자서 짜글이를 먹을 거라고 하자 나는 자면서 꿈에서 먹겠다는 이야기를 하고 있다
생일짱축하해내찡구  가꾸싶은거말해다말해 고마워 근데너도갖고싶은거말못했자나 이모티콘악마 악마씩이나 우리그럼담에 12차 서로 쏘기해 아주조아 담에만날때우리둘생일기념으로 맛잇는거먹자,친구 생일이라 갖고 싶은 것을 물어보지만 다음에 만나서 맛있는 것을 먹기로 한다
아니 근데 이제 잘 안 들여다 봐 네이버페이 진짜루 아 티끌이라도 미련 있어서 그래 왜냐면 나도 차단 안 하고 구애인 계정 이런 흔적만 봤음 티끌 있었어 티끌도 없으면 뭐 계정이든 뭐든 차단하지요 궁금한 마음도 임,차단 안 하고 구 애인 계정 흔적만 봤다며 미련 있어서 그렇다고 하니 상대방도 티끌도 없으면 다 차단한다고 한다
잠시 근데 이렇게 비싼거 사줄려고 미안구로 지 가게에 잌는게 이거래 우리가 사려던게 머엿지 코스트코에 있는거 웅웅 시스템사진 이고얌,코스트코에 있는 걸 사주려고 했는데 가게에 있는 것과 같은 비싼 걸 사주려고 한다
저녁막고래 해 응응 햄버거 시켜목을거갗아 그려 먹으면서 해 그냥 애매해서 지금 집 가게  저녁 안먹어야지 얼릉가 시스템기타 시스템기타 이제 지하철 탄자 ,저녁으로 햄버거를 시켜 먹을 것 같은데 그냥 애매해서 지금 집으로 가고 이제 지하철을 탄다
시스템사진  실화  우와 교수님이 저런말도 아셔  젊게사시네 그니까 공지떠서 들어갔더니 내용에  이렇게만 써있어서 당황스러웠음 진짜 그랬겠다  아는 교수님,교수님이 젊게 사셔서 공지를 들어가 보니 내용에 제목이 곧 내용을 자음으로 줄여서 쓰여있었다고 한다
아니대체 누구야 근데 이름이 맘에안들어 할 왜 이름이야 누구지  아 이름탈락,대체 누군지 이름이 마음에 안 든다
아니 나 지하철인데 앞에 흰바지입른 여자 서잇는데 바지가 너무얇아서 앗저런 속옷 다보여 헐 말해줘야되는거아냐 뒷주머니가 그 슬랙스처럼 주머니가 바지위에 붙어잇는게 아니라 안주머니 혹시 주머니보이니 아씨 뭐라해야대 앗 와 진짜 말해줘야겠는데 주머니 패치 다보여 재봉선 할 모르나봐 누가좀 알려줬으면 안타깝다,지하철에서 앞 여자가 흰 바지를 입어 속옷이 다 보여서 말해줘야 하나 안타까워하고 있다
아니 그때 사진 보여줬자낭 보내줄데 잠만 기억안나 여기사람들도기억이안난다 시스템사진 진짜 97같지 안냐 96 같아 페북친추해 둘이쩔친해  아니 아직 그정도 아니야,얼굴만 보면 96 같은 사람과 페이스북페북 친구 추가친추를 하여 친한 친구가 되라고 하였다
흐규규규 조심히가 이모티콘 흐규규규규규 오빠도 조심히가 이모티콘 흐어어엉 더같이있고싶은데 흐규규규규규 왜항상 시간이 부족한것인가 나 지하철탔오 22분출발이래 응응,연인이 서로 조심히 가라며 더 같이 있고 싶은데 항상 시간이 부족하다며 아쉬워한다
벌써 목요일이 이번주는 뭔가 더 빨리 갔어   진짜 순삭 맞아  벌써 내일이 금요일 긍께 대박이여 정말 점점더 시간 빨리가,벌써 목요일로 이번 주가 너무 빨리 갔다
요새 진짜 다들 젊을때결혼한 내친구도 내년에 결혼한대  난 나중에 할래 지금 하면 후회할것 같아성 나도 넘 빨랑 지금하기엔 내 청춘이 아까웡 난 애기도 낳기 싫어 둘이서만 행복하게 살아도 될듯 ,친구들이 젊을 때 결혼을 하는데 지금 하면 후회할 것 같아서 나중에 할 거라 한다
좋아하지만 귀찮다 이걸까 이름도 내 마음은 알 거야 하지만 넘 무심한 것 같다 라구 생각 하겠지 글구 이름는 이미 응 너 덤병고리는 고 알아서 할 듯,다른 친구가 무심하다고 생각하지만 괜찮을 것이다
언닝 이름 둘다데리고가실거죵 나 이미 지쳐서 못갈거같아 지금 이미 지침 미안해 안그래도 톡할라했는데 아정말여  알겠어여 언니 안가시는거죠  옹 못갈듯 네넹,이미 지쳐서 못 갈 거 같다고 톡하려고 했다
게다가 동생이랑 동생친구들이 불러주는 거니까 엄청 좋아할 것 같더라 근데 울기는 내가 울었어 감정이 복받쳐서 그냥 언니를 너무 좋아했었지 지금도 그래 세상에서 우리 언니가 제일예뻐 그렇구나 언니는 자주봐 언니 서울에 있어 예전엔 서울 놀러가면 꼭 보고 왔는데 지금은 보고싶어도 못봐,동생과 동생 친구들이 불러주는 거라서 엄청 좋아할 것 같았는데 내가 울었고 예전에는 서울에 놀러 가면 언니를 꼭 보고 왔는데 지금은 보고 싶어도 못 본다
이름가 마블 진짜 좋아하는데 이름는 두번 세번 보러가더라구요 쩐다 그래서 저한테 가끔 영업하던데 난 너의이름은 세번본듯 선배는 애니취향 아니야,마블을 좋아해서 두세 번 보러 가고 너의 이름을 세 번 본듯하나 애니메이션 취향은 아니다
와 모냐 프사 갸이뻐 인스타에 올려져 조아요 박게  조져떠 캬캬 이쁨 시스템사진 프사에있는게나아 아님 위에가나아 난 위에거 피부 훨 하얗고 이뻐보영,프로필사진프사이 예쁘다며 인스타그램에 올려달라고 해서 올리고 프로필 사진에 있는 게 나은지 위에 것이 나은지 묻자 위에 것을 선택한다
엄마 나완전 감기떄문에 일월화 아주 헤롱헤롱이었따 집에 와  엽떡과 kfc 있다  병원 안가고 버팀 독감일지도 모르잖아 얼릉 집에가서 뜨끈하게 뭘 먹어 병원갔다왓어 그냥 감기래 일욜날밤에 막 설사도 하고 그랬엇음 열도 남 장염에 감기랬어 약먹고 어제 저녁부터 팔팔해졋,일요일 밤에 설사하고 아파서 병원에 갔더니 장염에 감기라고 해서 약 먹고 어제저녁부터 괜찮아졌다
시스템사진 동생 오늘 연어 여섯마리 잡는대 핵 바쁜가봐 연어 집에나 좀 갖고오지  우와 왠연어 동생 낚시 해 요리하자너 식당 바쁘대  연어 저렇게 보니까 진짜 핵 크다,식당을 하고 있는 동생이 잡은 연어에 대해 이야기하고 있다
왜 여자가 좋아하는 몸하고 남자가 좋아하는 몸이랑 어떻게 다른데 여자가 좋아하는 몸은 뭐랄까 좀더 마르고 깔끔한거 그치 그게 이쁘자나 남자들은 약간 살도있고 그런 몸이 좋지 ,여자가 좋아하는 몸은 마르고 깔끔한 게 이쁘고 남자들은 약간 살이 있는 몸이 좋다고 하였다
뭐 웨이셤머 어딘데 전화 안받지 내일 아빠 나간대 그래서 엄마랑 나랑만 밥 먹어야함 이름씨릉 건강원에서 탈퇴시키겠습니대 왜요,내일 아빠가 나가서 엄마랑 자신만 밥을 먹어야 한다고 해서 지인을 건강원에서 탈퇴시키겠다고 한다
 지금 여행이나다니고시다 우울바이러스 오짐  이게지금여행도못다니고 마즘 다른사람들도우울병 여기에만 쳐박혀있어서그해 마니걸린듯,다들 여행도 못 다니고 처박혀있어서 우울병에 많이 걸린 것 같다고 한다
그리고 이름가 나 이름이라고 놀림   이름 닉넴 했잖아 인생 닉넴 일진님이 하사해주신 거부할 수 없는 별명,별명으로 놀림을 당했다
글고 요즘 엄마가 넘 치사해져써 왬 엄마가 네스퀵 3개랑 오곡라떼2개를 사왔거든 오곡이 평소 엄마최애 네스퀵이 내최애 근데 전날 밤에 네스퀵 사왔길래 양치해서 안먹고 낼먹어야징 했는데 일어나니까 하나도 없는거야 악 설마설마 오곡만있어 난 그거 안먹는데 노맛이라엄마가 다먹은거임 냄겨주시지,엄마가 네스퀵과 오곡라떼를 사오시고 오곡라떼만 남겨두셨다
시스템사진 뭐징 안먹는다매 구라지 바부야 편의점 다갔네  오늘 아님 못산다고 둘다 사라햇엉,오늘 아니면 못 산다고 해서 편의점에 갔다
그그래이름는좀많이 화를분출할핗요가잇어 후움어케하는지도모르겠는것 마자 그거슨 분출을좀해줘야하는것 밤엔좀조용히좀해 라고상냥한1차경고를하고 참으면병이나 계속그런다면 욕을할것 상냥할필요도없어,참으면 병이 나고 상냥할 필요도 없으니 누구는 화를 분출할 필요가 있다
쫌 민망하고 염치없네 머가 아녀 과제  이름한테 잘해주기 하믄대자낭  요즘 겁내잘해주는,과제 때문에 민망하고 염치없다고 하니까 잘 해 주면 된다고 한다
솜털처럼 삐져나오는 애들이 있어 역시 털들 끈질기닼 개웃기네 진짜 끈질겨 미친놈들 근데 그건 그냥 살짝 밀면 티 안 나지 않아 웅 근데 나는 아예 손을 안대고싶어 미는거 귀,솜털처럼 빠져나오는 털이 있는 데 손을 대고 싶지 않다
휴 또 싸우려나 언니가 뭐라한다해도 상황이 바뀔수없는거는 그냥 놔두기로 해여  에휴스트레스다 스트레스 당장 오란다고 올수있는 자리 아니니까 서로 기분만 상함  난 솔직히 오빠 회식 이런거 안갔으면 좋겠다 짜증난다 자영업해야함  결국저나로 한판 싸우고,오빠가 회식을 가서 싸웠는데 당장 올 수 있는 상황이 아니면 그냥 놔두는 게 좋다
이름이가  첨엔 남친 고기 구워준다고 와도 되냐해서 그러라했는디  막상 오니까 이름이가 다 해서 와서 쳐먹기만 함 도와주긴함  근데 이름이가 장본거랑 오늘 닭볶늠탕 값 분빠이 해야한다고 별로라고 이름이 남친 자기는 불편했다고 ,남자친구남친 고기를 구워준다고 왔는데 장 본 것과 닭볶음탕 값을 나눠야 한다고 해서 불편하다고 했다고 한다
그럼언제먹어 싸가서 먹어  먹지마 아빠줄게 미숫가루 타주면돼 그것때문에 먹는다고 할생각하지마쇼 그래아빠드려 엄마의 포인트는 간헐 알게또 응,엄마께서 간헐적 다이어트간헐를 하고 계셔서 드시지 못하기에 아빠께 드리기로 했다
마지막이군 이겨서 보자 받았다 드디어 퇴근  얍스  받음 굿 내일도 뜨기를 아침에 자다가 일어나서 틈틈히 확인했는데 오전은 안하던만 오케이 출첵 했다 오케이 출첵,마지막 것은 받았고 틈틈이 확인했는데 오전엔 안 하는 것 같다
얼굴부심 갑 이름 다음 갑 아니다 이름이가 갑 이름가 을  아 근데 응 시스템사진 이름가 더 내 스탈이다,얼굴 부심 갑이라고 하며 어떤 사람이 갑이고 또 다른 사람이 을이라고 하며 자기는 어떤 사람이 더 내 스타일이라고 한다
사진찌거죠바 만오처넌인가 이런 심주름꾼 그걸 어케 사진찌거  허억스 거실에 잇는데 에엥 머어땨,사진을 찍어달라고 하니 그걸 어떻게 찍냐고 한다
여붕 언제오셔 막차 기다리는중 이모티콘 피곤하겠다 응괜찮아  조심히왕 열심히 해야징 임원달라면 이름님 만들어드려야징  여봉 임원되는거 보려면 난 더 건강해줘야징 여봉 화이팅  자기는 건강만 하숑 자기도 건강챙겨야하는데내가 챙겨주지도못하고 자기도 건강 좀만신경쓰면서 일하고가족위해,반려자를 위해 열심히 일하겠다고 다짐하고 있다
시스템사진 나는사넹 샤넬 이뿌다 나는 샤넬사주는 형부없나 아마없을듯 왜 둘이결혼안해  아니지금없다구,지금은 샤넬을 사 줄 형부가 없다
수업끝나떠  오또카지 핵졸려 근데 점심엔 씻고 오늘빡센날이자나 준비해야할거같은데 하 아밤새고온거야  이모티콘 미칀 밤샌건아니지만 세시간 바께 못잤어 집가서자야지 쉅다끝나고,밤에 잠을 세 시간밖에 못 자서 수업 시간에 매우 졸리다
장기도 기계처럼 노후되나봐 맞아 인정인정 과음하면 진짜 여지없이 울렁거려서 깬나 깬다 차라리 취기있을때 토하는게 나음 토하는데에 죄책감이 덜해 일부러하는거토예 일부러도 그렇고 엄마가 토하는거 진짜 한심해해서 그런거에 대한 죄책감이랄까 일부러 하는구만 아니 근데 그래야 담날에 숙취가 덜하긴 혀 맞습니다 아주 저는 술마시고 숙취때문에 토나오는거 말하는줄머쓱,취기가 있을 때 토해야 죄책감도 덜하고 숙취도 덜하다
요즘은 내가 좀더 열심히 살고싶어졌어 사실 열심히가 중요한게 아니지 잘 살아야뎀 그래도 나중에 뒤돌아볼때 떳떳하고 싶더라고 요즘 음 후회없이 하고싶다 이건가 그건 뭐 동감이지,뒤돌아볼 때 떳떳하고 싶어서 열심히 살고 싶어 하고 있다
그럼 오전 오후사에이 근데 헬스 오후에 수업좋으면 다시 집가 카페가서 공부하게 피티 해주는거 아니면  너 하루에 그럼 이만보 넘게걸을듯 혼자 근력키우는거 진짜 힘들어 ,헬스 피티 해주는 것이 아니면 혼자 근력 키우는 것이 힘들고 오전 오후 수업 사이에는 카페에서 공부할 예정이다
아니 난 구애인이랑 쫄보라서 인스타에서 만났어 걱정했을텐데 이게 끝인데 더 안 쫄려 갠타나 그나저나 애인이 하더 안 맞아,전 애인이랑 인스타에서 만났다고 하니까 겁쟁이쫄보라서 나는 걱정했을 거라고 해서 안 쫄리고 괜찮다고 하면서 애인이 안 맞는다고 한다
귀에꼽으면 때려쁘러 가만히닛는디 기타빠져싸 기계는 디지게때려야함  오늘카페에서도 한 세번 할랭 넘게 날화나게함,귀에 꼽으면 가만히 있어도 계속 빠져서 화난다
이름자존감그리낮은애가아닌데 이상하게 거기서 못빠져나오더라 그게 사랑이구나 생각함 이래서 눈돌아가면 무섭구나아 아하 하긴 근데 내가 더 좋아하는 연애하면 진짜 자존감 바닥되고 내가 더 사랑받으면 뭔가 시간낭비하고 그런거같고 인정인정 근데 속상하겟다 뭐든 헤어지면 속상해 오락가락해 맨날나한테 전화해,지인이 더 많이 좋아한 연애였는지 헤어지고 힘들어해서 매일 나에게 연락이 온다
내 맨날 갈굼당하니까 알바애가 내 안쓰러워서 오늘 또 기프티콘 아아메 쏴줌  아닠 이게 말이 되는 상황입니꺼 근데 이런거 줄때보면  좋긴한테 일할땐 얜 맨날 꿀빨아서 쫌 배아픔  걔는 알반데 텃세부리나 니  전혀 안부린다,알바아르바이트애가 안쓰러워서 기프티콘을 쏴준 것에 대해 이야기하고 있다
엄마 유럽도 가야하잖아 가지 일찍 해버려 그럼날짜잡고오고 일단 상담 받구 괜찮다 싶으면 날짜 잡거나 먼저 해고 되고 수술하고 이틀뒤에 병원더가는거맞지 뒤에 병원은 같이 따라갈게 일주일뒤인가 의사 쌤한테 무러봐 그것도,엄마가 유럽에 가야 해서 수술 날짜를 언제 잡을지 이야기하고 있다
언니끝낫냐 엉 거기근처에 이마트24잇음  오늘 고모부가 이름랑 나한테 이마트상품권줌 오 잇음 써 언니가 짱이넹 이름꺼도달라할까 맥주나드셔 ,오늘 고모부가 준 이마트 상품권을 언니에게 줄 테니 쓰라고 말한다
이모티콘 굿모닝 이모티콘 굿모닝 잘잤오 응응 오빠도 잘잤어 응응 어제 굿나잇인사 보내고 나도 꽥 잠들었오  오빠도 피곤했구낭 응응 그랬나봐 히히히 휴가갈 생각하니까 너무 좋아,서로 잘 잤는지 인사를 하고 휴가 갈 생각을 하니까 너무 좋다
나 일월에는 카톡도 잠시 탈퇴하려고 이름이형 그냥 컴에서 카톡을 지워 돈은 타먹어야지 아맞네 나도 당분간 이름만 쓰고 이름로 단톡방 다 나가야겠다 이러다가 진짜 소속말곤 할수있는게 없는 몸이 될것같어 이제 1년남았다 뭐든지 일년안에 쇼부보고 이름이 그런의미에서 백수기간에 안되면  보험이나 팔아야지 돈버는거 알려드림 뭐임 카톡 조각모으면됨,카톡도 탈퇴하고 단독 방도 나간다며 뭐든지 1년 안에 결판 보고 안 되면 보험이나 팔아야겠다고 한다
또뭔꿈이더라 롤러코스터 타면서 딸기맛고구마맛호박맛아이스크림 먹는 꿈도 꾸고 마카롱 사는 꿈도 꾸고 나한테 동생이 잇엇는데 동생이 거의 10살 연상인 훈남오빠를 좋아해서 계속 문자 보내는거 보는 꿈도 꾸고 토르 꿈도 꿧음  몇개를꾼거야  워 5개 몰라 혼종 난그렇게꿔도기억안나던데,롤러코스터 타며 아이스크림을 먹는 꿈 마카롱 사는 꿈 동생이 좋아하는 남자에게 문자 보내는 걸 보는 꿈 토르 꿈 등 5개의 꿈을 꿨다
내 진실의 주둥이보이니 따흑 넘나 보고프다 입꼬리봐 저세상 행복이네 애기들 보려고 영상통화까지 하는 클라스 참사랑 진짜 넘 보고싶다 일주일 못보니까 현기증나욘 넘나 마약짤인데 행복한 이름  안보다가 영통으로 보니까 미쳐벌여  볼수는 있지만 만질수없는 미고유자,애기들을 일주일 동안 못 보니까 현기증이 난다며 영상 통화영통으로 보니 미쳐버릴 것 같다고 한다
이름단독생파야 멋지네 옹 이날 이름만 생일이었나봐 어린이집은 생일날해주는데 이름생일이 방학때라서 미리한거야 유치원은 한달에한번 모와서하고 이름 간만에 엄청즐거워보이넹 그러게 왠일로 웃으면서 사진찍네,방학이라 미리 한 생일파티생파에 대해 대화한다
이름가 넘 붙어 있으려고 해서 힘들어 붙어 있는 건 사실 괜찮은데 흠뭐랄까 기 빨리게 한다고 해야 하나 흠 어떤 막 집착 그냥 종일 자기 스트레스 받는 거 회사 트러블 엄마가 잠깐씩 뭐라고 하는 걸 응 동기화 급으로 일일히 하니까 흠 피곤하겠다 어제는 듣다가 넘 지쳐서 급 잔다고 함,본인의 스트레스 받는 얘기를 종일 너무 붙어서 얘기해서 듣기가 너무 지친다고 한다
아니 이름 잘생겼는데 아니미친 아니 유튜브에 떴는데 개잘생겼는데 또 배경화면 해놔야되나 외면 외면 외면 씨,유튜브에 떴는데 잘생겨서 배경화면으로 해야 하나 싶다
즨짜 그래서 천안나랑 되는듯 당연히 지 오기전에 일어난 일이니까 모르지 강열이는 그리고 천안나는 강열이한테 물어볼떄 너무 일진누나 같았다는데  니 뭐봤냐 흔들리는 꽃들속에서 가지로 맞아볼래,강열이와 천안나가 연결되는 것에 대해 이야기하고 있다
상상 속 인물 짜증나이렇게 사람이 없노 내말이 내가 남자였으면 조컷네 우리끼리 사귀자 사궈주세요 음 우린 친구자나 맞지우리 오래 친구해야지  우린 평생 친구지,왜 이렇게 사람이 없는지 짜증이 나서 우리끼리 사귀었으면 싶지만 그냥 평생 친구로 남기로 한다
나 일욜날 고척동갔었는데 니한테 전화했는데 역시나 전화를 안받았어 그때 폭풍과제하고잇엇을껄 니네집앞 파바였는데 흐규어쩐일로 왓으 가족들이랑 장터골 얘기하다가 오랜만에 가자 해서 갔다가 고척시장쪽으로 갔지  추진력봨 LTE여,집 앞에 간 김에 전화했으나 받지 않았던 일에 대해 이야기하자 과제 때문에 정신이 없었을 것이라고 해명한다
이름 알바몇시까지고 엄마가 또 지금은 니 밥먹었나 전화해봐라해서 전화한거 우리 밥먹으러갈거라 니생각났나봄 여덟시 지금일남  안나갈거야 전화할테니까 엄마보고 추석잘뷰내라구 할수있갰나 알바 6시에가야한다고 말하고 준비해야함 긍까 걍 1분정도만 8시에 가니까 1분정도통화는괜찮지않나 와이라노,엄마가 전화해보라고 해서 전화를 할 텐데 엄마한테 추석 잘 보내라고 1분 정도 통화를 해달라고 부탁하지만 아르바이트 갈 준비해야 해서 안된다고 거절한다
나 오늘 놀다가 타로카드 점 봤는데 내보고 선 긋는데 기타 특화돼서 여지를 안준대 특화될것까지 있나 쓸데없는 곳에 특화 그래서 남친 안생긴다나 주위에남자는 계속 있대 그리고 소개팅 안받고 가만히 잇으면 29살 까지 아무도 안생긴대 남자가 계속잇었나요,타로카드 점을 봤는데 선 긋는데 특화돼서 여지를 안 줘서 29살까지 아무도 안 생긴다고 한다
픽업 오키 와나어쩌지 자야하는데 이제 못자 자야한다는 부담감에 더 못자나봐 자지마 그럴꺼야 ,자야 한다는 부담감에 더 잠을 잘 수 없다
시스템사진 홀리싯 안경 두고옴  븅하 선글라스 무엇 힘내고,안경을 두고 온 상황에 대해서 이야기하고 있다
근데 왜헤어진거야 대체 오빠가 헤어지자햇어 차엿어 찻어  그게왜궁금해 그냥 왜헤어진지궁금하기도한데 그거생각하다보니 누가찼을까해서 근데 오빠가 찼지 왜 오빠가 다른여자가 생겼데 바람폈어 나쁜놈이었어 아주 소설을 쓰세요 작가하시지 그러셨어요 소설이라도 써야지뭐 안알려줘서 그냥 혼자만의 상상의나래를 펼치고있어,헤어진 이유에 대해 이야기하고 안 알려줘서 상상을 한다고 한다
쟈철에 빌런있다 바삭한맘스터치빌런 지하철에 맘스터치는 불법아닌가요 이런 배고픈시간은 완전 불법인데요 내말이 고소당해도 할 말이 없거든요 인정입니다 맘스터치 빌런 당신 내려주세요 ,배고픈 시간인데 지하철에서 맘스터치를 먹고 있는 이상한 사람빌런이 있는데 이런 행동은 고소당해도 할 말이 없다
근데 그러면 그 졸사라는게 학사모 쓰고 액자에 들어가는 그런 증명사진형태의 것일까 나도몰라 애들한테물어볼까 그냥 잔디에서 전신샷 찍는건가 둘다인가 왠지둘다일거같은데,졸업사진졸사가 어떤 형태의 사진인지에 대해 대화한다
어디서 우울증걸리면 건망증 생긴다 이런얘기 듣고와서는 맨날 뭐까먹는척 그랬는디   근데 연기못해서 다티나 야 솔직히 나랑 중일때부터알앗는데 내이름까먹은건 에바자나 근데 나한테와서  이름까먹었다고 어 이름아 아아니지 너이름이 뭐더라 이런,중학교 1학년중일 때부터 알았는데 이름을 까먹었다고 해서 연기하는 티가 났다
엄마 글씨 진짜 이쁜데 맞아 내가 아는 사람들 중에 울 엄마 글씨가 제일 이쁨 그래서 왤케 글씨가 이쁘냐고 물어는디 엄마 어렸을 때는 글씨체 교본 같은 거 사서 연습햇대 아 그책 아직도 집에 있어 완전 궁서체로 따라 쓰는 거 그래 나중에 한번 봐야지 나도 좀 따라써봐야겟다 ,엄마가 어렸을 때 글씨체 교본으로 글씨 연습을 하셔서 글씨를 예쁘게 쓰신다고 이야기한다
수영장에 완전 수달이여  쌔빠지게 돌앗더니 박수안받앗나 배고프네  집에갈때 간식거리 사가  라면 사가야지 ,수영장에서 많이 돌았더니 배고파져서 라면을 사서 간다
