여보는 재직한지 3개월 이내니까 지금 신청해두 되징 아니 그건 안된다규 그거는 4대보험 합쳐서 12개월이내 첫 직장인만 신청가능한거고 우리같은 몇년된 사람들은 다른거야 옹 청년내일채움하고 그냥 내일 채움하고는 다르니께 근데 어쨋든 사업주 동의가 필요한거니께 이름실장님오면 해달라해야징,청년내일채움 공제와 내일 채움 공제는 다른데 어쨌든 사업주 동의가 필요하다고 하자 실장님 오면 해달라고 해야겠다는 이야기를 하고 있다
아니 난 진짜 게임만 하는데 못 참겠음 개웃겨 아냐 참아야 돼 진짜 예민한 새끼들 다 모였나 돈 너무 마니 썻어 게임만 하면 대지 만날 삐침 근데 삐쳐도 애들 이제 신경도 안 씀 아니 마피아가 기분 상하기 쉬운 게임인가,마피아 게임을 하다가 기분이 상한 사람이 많다
허리 잘못나가면 최하 천오백 깨진대 아 헐랭 나 급 바른자세로 고쳐앉음키 언니도 허리 폈다 바른 자세로 생활하자고  목도 반듯하게 허리도 꼿꼿하게 그래그래 천오백이면 중고차 한대값이여,허리 잘못 나가면 최하 1500만 원 깨진다며 바른 자세로 생활하자고 하자 상대방이 바른 자세로 고쳐 앉았다고 한다
낼 병원가 위가 기타 팽창해 엥 결국 가 흑 주말에 약이 없음 가야지 아프지 마 애기 호 오빠 속상하다  대신 아파조 그건 싫어 기타 냉정갈 아픈 건 네 몫이고 걱정은 내 몫이야,위가 불편한다 주말에 먹을 약이 없어서 내일 병원에 간다
미친 내가 미팅나가는 사람들 대화방에 님들 근데 남자79 만나고 시프세여  이랫더니 다 아니라는거야 엉 그래서 그럼 왜 이런짓 왜해 햇더니 79년생 얘긴 줄 알앗대 아니저기요 아니 79년생을 왜만나요 제가 개웃기네 아나,남자79라는 사람을 만나고 싶지 않은 이유는 79년생 이야기인 줄 알았기 때문이다
그것도 내가 잘 받았냐고 물어봤다 고맙다고 장문의 문자를 보냈다매용 너무 깜깜 무소식이라서 카톡으로 얘기하다가 내가 물으니 장문으로 쓰더라 지도 아차 했나보지 당황했나봄,너무 소식이 없어서 카카오톡톡으로 잘 받았는지 물어보니 본인도 아차 싶었는지 장문의 메시지를 보내왔다
내혼자 집와따 두시 마치나 어 두시 이모 문현동 갔나 응 아라따 두시에 마치고 간다 응 오냐요,집에 도착했음을 알리고 끝나는 시간을 확인한다
나 낼 연차냈는데 나는 내일 없다 호곡 왜 낼 어디가는데 혼자 놀아라 언닌 어디가길래 나 내일 기장간다고 누구랑  친구랑  혼자노샘,연차를 낸 동생에게 언니는 내일 친구와 기장에 가기 때문에 혼자 놀라고 말한다
친형이 소곱창 사줘서 먹으러왔다   아 부럽다 맛잇게 먹거 너는 지금 놀 사람이 잇구나딴 사람 찾으러 가야겟다   너 근데 밥 안먹지 않았냐 올라오면 배고프겠다 아냐 나 집에서 너무 많이 먹엇서 자제 좀 해야겟서 이제 하  나도 살 다시 빼야하는데,친형이 소곱창을 사줘서 먹으러 간 것이 부럽다는 것에 대해 이야기한다
웅 울반제일작은애 아무래도안되겟다 얘또토해 물만토해  어찌냐 집에보내야겟어 웅 전화드려욧 내무릎에누워서아빠기다려,우리 반 제일 작은 애가 무릎에 누워서 아빠를 기다리고 있다
나이사진쩜 맘에드는데 별루임 먼가 훈녀같음 이뽀 이뿌긴 한데 감사  한데 한데 뭐   이쁘긴 한데근데표정이 가증  이게 그나마좀 자연스러운듯 마자 표정은 가증스러워도 사진은 이쁘니돼씀,이 사진이 마음에 드는데 별로냐며 이에 대해 이야기하고 있다
그냥 아무도 안간다하니깐 마음이 아무도 안가면 너도 그 아무에 속하면 되겄네 누구한명이라도 가지  나여도 안감  이미 퇴사하고볼 일 없는 사람인데 그사람이 너 결혼식에 올거같으면 가,퇴사하고 볼일 없는 사람인데 아무도 안 간다고 하니까 마음이 걸려서 결혼식에 올 것 같으면 간다
계속 아빠가 못갈수도 있데 짜증나 옆에서 너무해 아니 진짜 계속 그러니까 못갈거같고 그래 아냐갈거야 일단 너무 걱정하지 맞시다  웅웅 꼭 갈거야,아빠가 계속 옆에서 못 갈 것 같다고 해서 진짜 못 갈 것 같다고 해서 걱정하지 말라고 했다
애들이 기다리고있어서 빨리 정리하려다가 쓰레기 버리다가 재활용 쓰레기 버리는 곳이 따로 없어서 사람들이 쓰레기통 위에 커피컵같은거 엄청 올려놓는데 웅웅 설마 짐으로 그거 쳐가지구 바닥에 커피 다쏟음 아 미치겠따 헐 욕할뻔했어 너가치웠어어떡해,쓰레기통 위에 커피컵을 쳐서 바닥에 다 쏟았다
이름 다시 사귀는거지 난 사실 헤어질줄 너무 힘들었던 것 같아서 그런것같다라구 혹시나 해서 궁금해사 아까 인스타 들어가봤는데 다시 팔로우 되어있던데 아 진짜 난 팔로우 끊은것도 몰랐네 그럼 다시 사귀는거 맞지않을까 이름가 헤어졌다거 말할때 그거 관련해서 말해서 알고있었어 아항 아 맞다 차단했다 했지,한 커플이 헤어졌다가 다시 사귀는 것 같다는 것을 인스타그램인스타를 통해 추측했다
시스템사진 나는 용돈받았다 부럽다 세상에서 제일은 아니고 무튼무튼 부러워 부러워   웅웅 얼마받아떠 50  장학금 쏠쏠하노,용돈을 받은 것이 부럽고 50을 받았고 장학금이 쏠쏠하다
오오 가족들다모여있어 멀랑 연락안대 집가는중 후딱가서 같이저녁먹어용 호홓호 왕방계곡 갓대 자긴두고,집에 가는 중인데 가족들이 자기만 두고 왕방계곡을 갔다고 한다
이름이 진짜 절대 디즈니는 용납 못하나봐 디지니 진짜 아 웃겨 징하다 몇번 말해도 우리가 정정해서 말해도 고집 뒤짐 곧 죽어도 디지니다 내말이,몇 번을 말하고 정정해서 말해도 절대 디즈니는 용납이 되지 않은가 보다
아니 우리가 오름못가서  원래 점심먹고 오름가고 저녁먹어야하는데 오름을 못가서 점심먹고 카페가고 저녁먹으러 3시간도 안돼서  갔더니 그럼 나도못먹음 애들이 밥한숟가락씩밖에 못먹는데 난 한공기다먹음,점심을 먹고 카페에 갔다가 3시간도 안 돼서 저녁을 먹으러 가서 애들이 밥을 조금밖에 못 먹었다
맞아 진짜 무서워서 못가 안돼 담주 친구 결혼식인데도 안감 원래 갈 생각도 없었  서울이에여 수원 근데 지금 경기도도 난리잖아 간다고 그러면 우리 부모님 난리날듯 대구가는것도 별로 안 좋아하는데  큐 맞아요 ,다음 주에 친구 결혼식이지만 무서워서 못 간다며 부모님도 난리 나실 거라고 말한다
꿀잠자따 나두 너무많이자서 머리아팤  나두여 일어나보니까 전아마두시반부터 잔거같아여 5시에 잠깐깨서 자기카톡보고 웅웅 또잣어 잘해써여 우리 그만큼 재밌게 놀았다는 거잖아여 ,서로 너무 많이 잤다고 이야기하고 그만큼 재미있게 놀아서 그렇다고 한다
나는 왜이렇게 글을 못쓸까 팍팍 일단 블로그먼저 할까   제발 급한것부터 좀 해 이거 9일까지야 그럼 중요한거 아무래도 블로그보단 그게 더 중요하자나  그거부터 하셈 ,블로그보다 중요한 것을 먼저 하라고 조언했다
아 가족들도 뮨제린데 이름걸리고 너희가족 긜림 우리는 진짜 아니 진짜 그렇게되면 둘다엄마아빠 기저질환있어서 위험해 우리 진짜 하  우리집은 평생 사죄해야지 진짜 허허 코로나 걸리면 헤어질각이지 이건,기저질환이 있는 연인의 가족이 코로나에 전염되었을까봐 걱정한다
언니 이름언니 연락해봤는데 5시이후면 아무때나 괜찮다고 하시네요 오늘가려고 언니 다음달에 해도 괜찮아요 당근 난 전혀 안급함 네넹 ,동생이 언니에게 다른 언니가 오후 5시 이후면 아무 때나 괜찮다고 했다고 말을 전해주고 있다
아니  사진에 너 친구분 표정이 웃기셔서 아 인정 너무 시강이잖아 야 근데 쟤 기타 이뻐졌다니까 시스템사진  핵존예야 아니 저때도 괜찮으심,사진에 친구 표정이 웃기다고 하니 지금은 예뻐졌다고 한다
진심 반발심리드는거있지 엄마가 자꾸 아무데도 못가게하니까 내가그래서 아니 코로나가 퍼진건맞는데 대구자나 서울아니잖아 이랬더니 서울도 퍼지고있는거 모르니 이러는거야 솔직히 지금 서울이 5백명 걸리고 그러면 약속취소라도 하겠는데 여기는 너무 멀쩡한데요 우리구는 1명도 없음 심지어 흑 맞어 잘 씻고다니면 되는데 진짜 그럴일은 없겠지만 만약 놀고와서 걸리면 엄마한테 죽을것 같아 코로나때문이 아니라 솔직히 마스크쓰고 계속 손자주씻고 그럼 되지않음 맞아 마스크만 안벗으면 되는데 손잘씻구,코로나 때문에 엄마가 자꾸 아무 데도 못 가게 한다
히히 그래도 최소 두시간라도 자자 끝나는대로 달려가끄야 꺄 주아주아 넘 피곤할텐데 일단 지금 자보자 자장가 불러주던지 자장가로 있지 불러주 귀여워 불러주께 우리애기를 위해서라면,너무 피곤할 텐데 지금 자라면서 자기를 위해 자장가를 불러주기로 한다
 강아지들 생각보다 똑똑해 짱이는 집가는 길이라 신나서 개빨리걸어옴 얘는 죽어도 안가진짜 얘가 나보다 걸음 빨라 집가는길 아니라서 똑똑한 강아지 시스템사진 졸귀,강아지들이 생각보다 똑똑하고 짱이는 집에 가는 길이라서 신나서 빨리 걸어왔고 다른 애는 집에 가는 길이 아니라서 죽어도 안 간다고 한다
있잖아 나도 누군가에게는 진짜 나쁜 사람일수도 잇겟지 왜 무슨 잘못햇어 아니그냥생각해보니까 나는 내가 당한 피해만 생각하고 살잖아 근데 나도 남한테 피해를 줬을 수도 잇겟다 싶어서 아그럴수도 잇겟네 의도하진 않앗어도  내 말에 누군가는 상처받앗을 수도 있고 좀 더 유하게 살아야겟어 모든 일에 내가 정답은 아니니까 함부로 남 판단하거나 평가하지 말고 좋은 말이다 세상에 진짜 정답은 없는 거 같음 마자마자,내가 당한 피해만 생각하고 살았는데 나도 누군가에게는 나쁜 사람일 수도 있지 않을까 하며 유하게 살아야겠다며 이에 대해 이야기하고 있다
시스템사진 악 기여워 머야 인형아니에여 역동적인 아기   팔 왜케 가늘어  기여오 털밀어서 저때는 밀어서 너무기여워여 푸들이 또 더리가 길어서 나랑 다르게 지금은 털쪗어요  넹 찌다못해 삽살이,푸들의 털을 너무 밀어서 긴 푸들의 다리가 더 가늘어 보이는 예전의 사진을 보여주면서 지금은 털이 많이 길어서 삽살개 같다고 한다
애기들 도착했때 9시 쪼금 넘어서 들어올꺼야  앗 그러크만 아직까지 잠시 숨 돌리는 타임이겠네 월요일이라 힘이 쭉 빠졌다가두 눈 뜨면 저녁이겠지 생각에 희망적이네 뭔가  그칭  오늘도 후딱 하루가 지나가겠즤 엄청 후딱 가버릴거같옹,아기들 9시 조금 넘어서 들어온다고 하니 잠시 숨돌리는 시가 나겠다며 눈뜨면 저녁일 거라는 생각에 희망적이라고 한다
선물은 머 사드릴까 그냥 용돈드리기로한거아녀엉  케이크하나사갈까 좋쥐 난 골프공 하나 사드려야쥐 골프공얼마야 안비싸 글쎄 시스템검색 공은 어차피 잃어버리는거아냐 넘비싼거 사디마 아껴뒀다 쓰시겠지,선물로 케이크 하나를 살지 고민하고 있다
근데뭔가 의사한테 인정받은 상커플이였어 웅웅올 담에는 상커플 수술 안해도되겟냐고 물어봐야겟다 얼굴형도그렇고 그람 혼날거같긴 한디 당연혼나지 일부러 혼나려고 물어보는거군요 계란형인줄 몰랐다고 얼굴형 얘쁜 얼굴형인줄 몰랐다했믄데 어머머 이지지배바라 이런늒낌이엿어 오마이갓,의사에게 쌍꺼풀 수술을 안 해도 되는지 물어보면 혼날 것 같다
우린 등산마치고밥먹고 올레길도는중 이에요 오오오 전 밥먹고 뒹굴  할딱고개까지 갔다왔어요 내려와서 파전에 동동주 캬  뒹굴 나도 집가서 뒹굴하고싶어요 엄청피곤피곤 헉 파전에 동동주  저도 운동하러 갈거예요 저녁에   동네한바퀴 넼 동네한바퀴 돌거예용,각각 등산을 마치고 올레길을 돌고 내려가 파전에 동동주를 먹을 계획이고 집에서 뒹굴다 동네 한 바퀴를 돌기 위해 나갈 계획이 있다
고양이들도 고로롱 자고 이모티콘 강아지들도 평상아래서 자고있는 조은 날씨다 낮잠타임인가 낮잠타임이네용 이시간에는 다들 코오 코오 노곤하겟다,고양이들도 자고 강아지들도 평상 아래서 자고 있는 좋은 날씨라고 하니 낮잠 타임 인가한다
오늘도 언니집 가나요 우리집갈래요  일단집가서 그럼 지금 열심히 디저트 만들어야해 아빠염색해줘야햅 아아 헙 염색해주고 나오는고야  나올수있쪄  일단열심히만들어봐 웅웅,일단 집 가서 아빠 염색해 줘야 하니 일단 디저트 열심히 만들라고 했다
 이게 사진에는 없지만 찍어주는 사람이 너무 귀여워서 저런 표정이 나오는거야  나한테 거기 있으라구 하고 총총 뛰어다니는게 너무 귀여워섴 나도모르게 함박웃음 짓고 있었나봐 이모티콘 근데 자세 어색한거봐 근데 자세가 너의 저 해맑은 표정과 너무 잘 어울려 이모티콘 너무 좋아  오늘 소속가 너무너무 예쁘고 이름가 좋아하는 곳에서 최애뷰 봐서 너무 감동적이었어 어디가서 소속 예쁘다는 얘기 못하겠다 이제 소속가 최고임  이것이 바로 이름의 논리다 소속 다니는 애가 그렇게 말해야 찐이닼,이대에서 찍은 사진을 보며 사진 찍던 상황을 설명한다
이름 예쁜데 발랄한게 넘 귀엽다  이름 누나누나   아이가 둘다 저렇게 귀엽다니 언니 복받으셨다  원래자기자식은다귀요오 이름 이름인 남들이 봤을때도 귀엽자나 자기 자식 자기 눈에 귀여운건 당연하고  남들 눈에 귀여워야 찐귀여움 이지 모르냐  남너뿐이야,자기 자식은 원래 다 귀엽고 남들 눈에 귀여워야 진짜 귀여움이다
네명 다만나려면 장난아닐듯여 지금그럼 건축남아니어도 되는거아니에여 말하는거 별루걱정안해도될듯 근데 건축이베스트라서 그래  그나마 젤 매력있네 비주얼이든 성격이든 헐그중젤맘에드는 글치   내가먼저소개해달라햇으닝 오늘최선을다해봐여 일단,네 명을 다 만나려면 장난이 아닐 것 같다고 하고 그중에 베스트가 건축이라서 최선을 다해보라고 한다
넌집에서뭐맛난거먹음 육개장해주심 과일먹곸 내가좋아하는과일사주셨어 근데난지금폭설중 88  나도육계장먹고시프다 나도왠지집가서 폭식하고 폭설할듯 쥬글거같다 그래도 또뭐먹을거자나 글쎄,지금 무엇을 먹는지에 대해 이야기하고 있다
요즘은 친환경 소재의 리필품이 많잖아 음 세제나 아님 샴푸같은 거 오 맞아 화장품도 그런 리필품이 있으면 어떨까 싶더라 그럼 가격도 저렴해지겠넹 그치 리필용기에 든 화장품은 가격도 저렴해질 거 같고 환경에도 도움이 될 거 같아 좋은 생각이야,요즘 친환경 소재의 리필품이 많은데 화장품도 리플품이 있으면 가격도 저렴해지고 환경에도 도움이 될 것 같다
초딩때진짜좋아했던건이름인데너한테 헐 이름 응 너이름 좋아햇다고 걔이름랑사귄걔 걔초딩땐얼굴 이쁘게생겼었는데 알아 ,초등학교초딩 때 얼굴이 이쁘게 생겼었다
아 나 오늘 인스타에 플립 자랑글올렷는데 많은 친구들이 반응해줫고 내지갑을 걱정해주더라  아 플립진심 이쁜데 넘비싸 그치 눈물난다 그래도 나요즘 너 부럽다  그치 플립이 이쁘긴 이쁨,인스타그램인스타에 플립을 자랑을 했는데 이쁘지만 너무 비싸다
간지나기 힘드넹 왜냐면 내가 차알못이고 다른애들 다 차잘알이니까 몇명못속이고 노간지만 남게돼 헐 노간지이미지박히면 힘들어져 마쟈 그러니 고심해서 잘고르라해 알아서하라하게 귀찮아,내가 차를 잘 알지 못하고차알못 다른 애들은 다 차를 잘 아니까차잘알 몇 명 못 속이고 멋없음노간지만만 남게 되고 이미지 박히면 힘들어지니 고심해서 잘 고르라고 한다
임산부한테 자리 양보함요 합정쓰임 오 잘했어 믓쪄부러 벌써 합정이네 보자마자 바로 일어나서 앉으시라고함 잘했어얏 남편분도 감사하다고 인사함 칭찬해얏,임산부에게 자리를 양보하고 감사 인사를 받았다
좀 일찍 일어나야댓는데 흑 밥도 못먹고 나왓네 어딜 부지런히 가세요 학교 가죠  시럿 잘다녀와 웅 버스 잘못 내려서 킥보드 탓네   날아라이름,학교에 가기위해 일찍 나왔어야 했는데 버스를 잘못 내려서 킥보드를 탔다
또 이별의 아픔그런건 시간이약이라 시간지나면 잠잠해질건데 돈버려가면서 붙잡을라한게 리얼 넘아까워 이름는 후회도인들듯 더이상 할수잇는데까지 다해봄 맞어 누가 70까지 쓰면서 붙잡아보냐 70이면 어우,이별의 아픔 그런 건 시간이 약인데 돈 버려가며 붙잡으려 한 게 아깝다고 한다
님아 님 정신줄 어디가셨어요 워터픽 왜 안끄고출근함 내안썻는데요 행님아가 마지막으로썻자나요 호엑 나 어제 아침에 잠긴거확인했는디 뭐여 무서브 자기가 해놓고 나한테 화내기 금지 호엑죄송해여 사과합니다,형이 워터픽을 왜 안 끄고 출근했냐고 물어보자 동생이 형이 마지막으로 썼다고 대답한다
근데 대박 기달려 너 안같아디반데 올 돌았디바 아니냐 나 진짜 헷갈렸음 헐 그런 아니 징짜 넌줄 모르고 클릭하고 여행사진 있어서 알았댱,디바 같아서 못 알아봤는데 여행 사진이 있어서 알았다
난 그냥 부자2세 하고싶은데 안되 그럴라면 모부님 힘내시라고해 엄마가 부자가 부자1세는 좀 부담스러 되어야하자너,부자 2세를 하고 싶은데 엄마가 부자 1세는 부담스럽다고 했다
야야야 기타도서관 가봄 옹 고등학교때 한번 가봤당 왱 거기 자습실처럼 되어잇음 아님 시청도서관처럼 되이쓔 자습실이었지싶당 거기갈라구 거기 좀 찾기 어려윰,고등학교 때 도서관에 가보았는데 자습실같이 되어있었던 거 같고 찾기 어렵다고 말해주었다
슬라이딩하면 답장되는거 앎 모르겟음 왜몰라 슬라이딩머임 남이쓴카콕 왼쪽으로 밀어봐 대화 왼쪽으로 밀면 이거됨 신기해 님 엥 이걸왜몰러,카카오톡에서 대화를 슬라이딩하면 답장 할 수 있다고 알려줬다
얘 자꾸 아까부터 계속 전화와 원래 연락안햇는데 한번 받아봥 연락이 왜 계속오지 으엑 시러 분명 만나자할듯  얘 친구들이 다 나쁜애들이라 내가 얘 피해다녓어 헐대박 진짜 피해야겟다 이름도 심지어 점이야 수상해 걍 차단고고,친구들이 다 나쁜 애들이라 내가 피해 다녔는데 분명히 만나자고 할거 같아서 전화를 받기 싫다
비비 바르느 남자 싫어하고 그 애들 있잖아  걔네도 지금 생각이 마니 바뀌었겠지 욕하는 애들 있음 야 내 친구 진짜 그렇징 내 고딩 동창들도 다들 생각은 마니 바낌  진짜로 확 느껴,비비 바르는 남자를 싫어하는 애들이 있었지만 생각이 많이 바뀌었다고 한다
이름아 맞다 오늘어버이날이자나 옹옹 아 응 혹시너는뭐해드릴꺼아 나 안해 ,오늘 어버이날인데 뭐해드릴 거냐고 묻자 안 할 거라고 대답한다
아하 몰랐군요  이따가 말해주세요  오티피 준비중이욤 지금 접속중 네 불러주셔요,지금 접속 중이라서 오티피를 불러 달라고 하였다
이름아 나 부탁있는데 들어줄래 웅 뭔뎅 말해보아 응 케익 오늘은 제발 먹으라고 이름이랑 같이 반씩 와구와구해줘부탁이야 열어는 계속 보는데 못 먹겠는걸 나 진짜 매년마다 이름이 취향저격해서 케익줄건데 내년에는 더 예쁜걸로 해올게 그니깐제발 먹어줘 이모티콘 제발 아까워서 어찌 먹지진짜 맛잇게 먹는모습 보고싶다 알겠어요 오늘 또 도전해볼게용,아까워하지 말고 케이크를 꼭 먹어달라고 부탁한다
손흥민 인기많아 잘생기진않았지만 키크고 그럼그럼 최고의 인기지 월클이니까  여자들이 좋아하겟네 오 월클도 알아  손흥민은 현지 사람들도 엄청 좋아할걸 민아랑 사귀지않았오 걸스데잌 응응 민아랑 사귀었지  인기스타네,손흥민은 사람들이 좋아하는 월드클래스이다
심리적으로다가 아무것도안한 내 자신이 부끄러워 차마 눈을 감지는 못하는중 정말 대단해 뭔가 하려고하는 의지는 만점이다 시험은 모르겟지만 의지는 만점 고맙3 의지점수로 시험점수 만회되겟지무 그래 의지점수는 만점이니깐 너무 걱정마라,시험 점수는 몰라도 의지 점수는 만점이니까 걱정하지 말라고 했다
준비하고 있는데 내게 톡온다는 소리지 응 만약 내가 11시반에 잔다고했을때 자기가 언제올지 모르니까 계속 폰만보고 기다리다가 누워서 기다릴까 하고 잘준비하는중에 보통 톡이오지  알겠어 그럼 답변보고 내가 아이구 우리자기왔네 하고 일단 답해주고 하던양치나 이런거 빨리끝내고 하던거는 마저 끝내긴 해야지 오는거지머,보통 잘 준비를 할 때 카카오톡톡이 와서 일단 답변을 본 후에 하던 것을 마저 끝내고 오는 것이다
돈이없는것도아니고 걍 안주는거잖아 쟤 그니깐 진짜 아오 빡쳐 저런놈한테하필내가 걸려서 그래도 반응업으면 진짜 고소해야지 어휴 흑흑 개빡치네,돈이 없는 것이 아니라 그냥 안 주는 것인데 저런 놈한테 걸린 것이 매우 화가 나고 반응이 없으면 진짜 고소할 것이다
근데 내가 그만두고 바로 들어온  신입이 폰맡아서 뭐야 자기들한테 말 안하고 관둬서 그런가 일도 언니야들이 하는거 아니거든 아님언니야들은 또 재무섥케 이거 하는거 알거잇엇음 뭐야 근데 왜 난 도저히 아디서 화난지를 모르겟는거야 근데 굳이내가 또 연락해서 일 하는 것도 알고 몸안좋은것도 알고 아양떨긴 싫어서 뭐지 나도 연락안햇지 그니깐 아니 너무 이해안가네,언니들이 어디서 화난지 모르겠지만 아양떨기 싫어서 연락을 안 했다
애기 사랑해 내일저나할게 꾸댕 오빠 사룽래 잘자구 내꿈꿔어 웅웅애기두내꿈꿔  안뇽 이름오빠 나두이제잔다용 잘자구 내꿈꾸고 이쓰세요,서로 잘 자라고 안부 인사를 하고 있다
시스템동영상 이것들 좀 보시게나 이름 천재견이야  너무 웃기지 저거 하기 쉬워 이름도 해봐 땡소리 하게 하고 간식주면 되는 거야 첨에 손에 종 쥐고 손달라고 하면서 거기 치면 간식주다가 계속 반복하면 자기가 치더라구 이름 너무 웃겨진짜 얼마나 뿌듯하던지,손에 종을 쥐고 손 달라고 하면서 간식을 주면 나중엔 반려견이 종을 치는 동영상을 보는데 너무 웃긴다
이름이랑 커플티인데 어떻게 널 주니 님한테 크다며 그럼 못 입잖아 어떻게든 입어야지 포기하고 나에게 넘겨 안돼 한두번 입을 수 있게 해줄게 그러다가 이제 내 옷 될걸,커플티라도 커서 못 입으니 자기한테 달라고 한다
이눔시끼 짜증이먼저야 내가 막으니까 나보고 밉대  밉다는 말을 해 아 나보고 밉다고 한건 이름랑 부딪힌거다 이휴 매번 애들이랑 부딪혀 어려서 그런거야 우리아들은 주짓수를 가르쳐야 겠어 주짓수,막으니까 밉다고 하며 짜증을 먼저 내는데 어려서 그런 것이다
아  완전 가기싫다 학원 집임  지금은 집임 아직 학원 안야 여름엔 조금 늦게 출근함 피곤하다 그래두,여름에는 조금 늦게 학원에 출근해서 아직 집인데 학원에 너무 가기 싫고 피곤하다
시스템사진 아 이것도 웃김  미친 꽃남이네 갑자기 추억팔잌 그치 그땐 멋있다 생각했는데 지금은 웃기기만해 앜 오글거리는데 약간 그때 열심히 보던 내가 생각나서 보는것도 있돠,예전에 멋있다 생각한 꽃보다 남자가 지금 보니 웃기기만 하고 오글거리지만 그때 열심히 보던 추억으로 보게 된다
